line,text
2986,effort to use Government resources for illegitimate and political — 
2987,66
2988,perhaps punitive — purposes would seem to constitute a violation of 
2989,"this provision; but in practice, proof beyond a reasonable doubt of "
2990,the requisite corrupt intent is difficult where there are objective indi- 
2991,cators in each case to support the argument that an audit of an 
2992,"“enemy” was, in fact, in order and consistent with normal IRS "
2993,"standards. Moreover, none of the incidents in question involved evi- "
2994,dence of payoffs or other corrupt practices. 
2995,A second problem hindering successful investigation arose from 
2996,the fact that there were numerous inquiries and investigations by 
2997,other agencies concerning the matters under investigation by WSPF. 
2998,This often resulted in those principally involved learning substantially 
2999,all details of the matters WSPF was investigating even before WSPI — 
3000,and/or the grand juries — came to deal with them. These individuals 
3001,were able to smooth conflicting testimony and otherwise embroider 
3002,explanations which made continued investigation by WSPF difficult. 
3003,Some witnesses who were dealing with WSPF often were close and 
3004,long-time associates of those under investigation. 
3005,Despite these problems the grand jury’s investigations did go 
3006,far in detailing the facts of what had transpired in the area of White 
3007,"House abuse of the IRS. Indeed, in fully investigating the facts of "
3008,"the two specific incidents noted above, WSPF and the grand juries "
3009,received the testimony of perhaps a hundred or so witnesses. It was 
3010,"concluded ultimately, however, that there was insufficient evidence "
3011,and/or substantial legal problems mitigating against the bringing of 
3012,any criminal charges. 
3013,White House “ Responsiveness Program ” and Related Matters. Evi- 
3014,dence obtained by the Senate Select Committee and provided to 
3015,WSPF in 1974 indicated that as part of a “Responsiveness Program” 
3016,"conducted by a staff unit in the White House, certain White House "
3017,"staff members had attempted in 1972 to channel Federal grants, "
3018,"contracts, loans, subsidies, and other benefits to persons and organi- "
3019,"sations supporting President Nixon’s re-election campaign, and to "
3020,withhold such benefits from those opposing his candidacy. Two in- 
3021,stances of possible criminal conduct were alleged to have taken place 
3022,pursuant to the “Responsiveness Program”: the dropping of an anti- 
3023,discrimination suit brought b}^ the Equal Employment Opportunity 
3024,Commission and the rescinding of a Labor Department subpoena 
3025,directed at a union which was supporting the President. The prose- 
3026,cutors began their inquiry by obtaining background information and 
3027,the names of about 30 people who had served as White House contacts 
3028,in the various agencies for the “ Responsiveness Program.” The 
3029,prosecutors then requested the FBI to interview White House staff 
3030,"members allegedly involved, the agency contacts and other witnesses. "
3031,67
3032,One of the prosecutors also reviewed the Labor Departments files 
3033,regarding the rescinded subpoena. 
3034,When additional White House documents became available to 
3035,"WSPF in spring of 1975, various files were searched for documents "
3036,relating to the “ Responsiveness Program” in a further effort to learn 
3037,whether violations of laws had occurred. On the basis of this investi- 
3038,"gation, it was concluded that certain memoranda obtained by the "
3039,Senate Select Committee had exaggerated the effect of the “Respon- 
3040,"siveness Program” and, accordingly, no criminal charges resulted from "
3041,WSPF’s inquiries. 
3042,A similar investigation probed an allegation that the Department 
3043,"of Labor had delayed, and, in some matters, also denied the promul- "
3044,gation of various occupational health and safety standards in return 
3045,for contributions to the President’s campaign. A memorandum un- 
3046,covered by Senate Select Committee investigators appeared to sub- 
3047,stantiate this charge and led the prosecutors to ask the FBI to inter- 
3048,view about 10 individuals about the matter. One witness was also 
3049,called before the grand jury. It was concluded on the basis of this 
3050,investigation that no violations of criminal law occurred. 
3051,The prosecutors also received allegations in March 1974 that White 
3052,"House officials, for the purpose of assisting President Nixon’s re- "
3053,"election efforts, had set up the Federation of Experienced Americans "
3054,"(FEA), an organization sponsoring programs for elderly citizens, and "
3055,had made efforts to shift Federal funding to FEA from the National 
3056,"Council on Senior Citizens and the National Council on Aging, two "
3057,"established organizations of the same type, which had not supported "
3058,the President’s policies and were not expected to support his re-election 
3059,"campaign. The General Accounting Office (GAO), had conducted an "
3060,earlier investigation of FEA and found that White House officials 
3061,had brought pressure on Federal agencies to award funds to FEA 
3062,and had helped it to obtain a donation from a corporation. The GAO 
3063,investigation resulted in the termination of Federal funds to FEA 
3064,because of financial improprieties. The prosecutors reviewed the GAO’s 
3065,"files and, at WSPF’s request, FBI agents interviewed more than 40 "
3066,Government agency employees and White House and FEA officials 
3067,about possible White House efforts to channel funds to FEA and 
3068,possible FEA activities in support of the President’s 1972 campaign. 
3069,No evidence was developed to support criminal charges. 
3070,Investigation of Alleged Mistreatment of Demonstrators 
3071,"Investigation Into an Assault on Antiwar Demonstrators, Newspaper "
3072,"articles appearing in June 1973, and information obtained in the "
3073,"early stages of the Watergate investigation, suggested that officials "
3074,of the White House and the Committee to Re-Elect the President 
3075,had directed an organized assault on antiwar demonstrators on the 
3076,"steps of the Capitol building on the evening of May 3, 1972. "
3077,The antiwar demonstration in question featured a number of 
3078,"leading antiwar activists. Coincidentally, but unrelated to the demon- "
3079,"stration or the assault, a public viewing of former FBI Director "
3080,J. Edgar Hoover's coffin in the Capitol Rotunda took place a short 
3081,distance from the site of the antiwar demonstration. 
3082,"The early stages of WSPF's investigation, which began in July "
3083,"1973, revealed that a group of 10 individuals, some of whom had "
3084,been involved in the break-in of Dr. Fielding’s office in California 
3085,and some of whom subsequently became involved in the illegal 
3086,entries into the Democratic National Committee headquarters at 
3087,"the Watergate complex, had been present during the assault. Their "
3088,"transportation from Miami was financed with $3,200 in campaign "
3089,funds. 
3090,"On the basis of this and other evidence, WSPF conducted an "
3091,extensive investigation into this incident because of the allegations 
3092,that the assault had been ordered by White House officials and be- 
3093,cause of the close connection between this event and the first Water- 
3094,gate break-in 3 weeks later. It was also considered significant that 
3095,the original $1 million plan from which the Watergate burglary evolved 
3096,included a proposal for mugging squads to rough up demonstrators. 
3097,"Thus, the investigation sought to determine any existence or implemen- "
3098,tation of a general plan to use paid operatives for the purpose of violent 
3099,activity against demonstrators and other anti- Administration activists. 
3100,"Accordingly, more than 150 witnesses were interviewed including "
3101,"victims of the assault, witnesses to it, police officers, and White "
3102,House and CRP personnel. Witnesses who resided a long distance 
3103,from Washington and those of less significance were interviewed by 
3104,"the FBI. Of those interviewed, some testified before the grand jury. "
3105,A request for a thorough search of White House documents relevant 
3106,"to this investigation was made by Cox in October 1973, but relevant "
3107,materials were not made available to WSPF until the spring of 1975. 
3108,This investigation consumed a substantial portion of the time of 
3109,two attorneys over a 6-month period. On the basis of several factors 
3110,"cited in Chapter 2, no criminal charges were brought. "
3111,Investigation o f Alleged Mistreatment of Demonstrators at Presidential 
3112,Appearances . A newspaper story in August 1973 alleged that persons 
3113,who appeared to be demonstrators against or opponents of the Nixon 
3114,Administration had been excluded or removed from the public coli- 
3115,"seum in Charlotte, N.C., on the occasion of the President's appearance "
3116,"there on October 15, 1971, and that this activity had been conducted "
3117,by local volunteers from the Veterans of Foreign Wars recruited by 
3118,White House advancemen. The prosecutors had previously been told 
3119,that advancemen had made similar attempts to keep demonstrators 
3120,away from the President as he made public appearances around the 
3121,69
3122,"country, and they then interviewed a former advanceman about these "
3123,"general allegations. After the publication of the newspaper story, "
3124,WSPF received from a citizens’ group a report containing specific 
3125,allegations of mistreatment of demonstrators at various Presidential 
3126,"appearances, including the Charlotte incident, from 1971 to 1973. "
3127,WSPF investigated these charges through office and FBI inter- 
3128,views of former CRP and White House officials including the advance- 
3129,"men, and through an examination of White House tapes and docu- "
3130,ments which became available in the spring of 1975. Some of the 
3131,witnesses were questioned before a grand jury. 
3132,"In mid-September 1973, Cox learned that the Civil Rights Di- "
3133,vision of the Justice Department was also investigating some of these 
3134,"same allegations. As a result, arrangements were made between this "
3135,office and the Civil Rights Division for a joint effort in which in- 
3136,vestigative responsibilities were divided between the two offices. 
3137,"Major witnesses, however, were interviewed by two attorneys working "
3138,"together, one from WSPF and one from Civil Rights. The investiga- "
3139,"tion, conducted over approximately a 3-month period, did not result "
3140,in the proof of criminal activity. 
3141,Investigation of President Nixon's Tax Returns 
3142,Newspaper articles appearing in the summer and fall of 1973 
3143,indicated that President Nixon had paid minimal Federal taxes on 
3144,substantial income earned during the period 1969 to 1972 because of a 
3145,deduction he had taken for the purported gift of his Pre-Presidential 
3146,papers to the National Archives. The White House claimed that the 
3147,papers had been given before the effective date of a 1969 tax reform 
3148,law that greatly reduced the amount allowed as a tax deduction for 
3149,"such gifts. After considerable public interest and speculation, President "
3150,Nixon made public in December his tax returns for the four previous 
3151,"years, along with supporting financial data and a request that the "
3152,Congressional Joint Committee on Internal Revenue Taxation deter- 
3153,mine whether he owed additional taxes. Both the Joint Committee 
3154,and the Internal Revenue Service investigated the matter. 
3155,"Late in March 1974, IRS notified the Special Prosecutor that its "
3156,inquiry had reached an impasse because of conflicts in the statements 
3157,"of those principally involved in the matter, and suggested that WSPF "
3158,conduct a grand jury investigation. While the IRS inquiry indicated 
3159,possible violations of law by former White House staff members 
3160,"whose activities were clearly within the terms of WSPF’s jurisdiction, "
3161,it also indicated the possible involvement of others who were not 
3162,covered b}^ the language in WSPF’s charter. To avoid any possible 
3163,"ambiguity, Jaworski requested and received from Attorney General "
3164,Saxbe specific authorization to conduct the entire investigation. 
3165,For about 7 months WSPF conducted an investigation to determine 
3166,70
3167,the facts concerning the alleged gift and whether efforts had been 
3168,"made to conceal the circumstances of the transaction. To this end, "
3169,the prosecutors interviewed and called before the grand jury a number 
3170,"of witnesses, including former White House staff members and officials "
3171,of the General Services Administration and its National Archives and 
3172,Records Service. They also received assistance from others who had 
3173,"looked into some of the questions, including the IRS, the Joint "
3174,"Committee, and the House Judiciary Committee. "
3175,The WSPF investigation resulted in the filing of charges against 
3176,three people. Former White House deputy counsel Edward L. Morgan 
3177,"pleaded guilty on November 8, 1974, to conspiring to defraud the "
3178,United States by participating in the preparation of backdated 
3179,"documents. He was sentenced to 2 years imprisonment, all but 4 "
3180,"months of which was suspended. On February 19, 1975, the grand "
3181,"jury filed a four-count indictment charging Frank DeMarco, a Los "
3182,"Angeles lawyer who had helped prepare President Nixon’s tax returns, "
3183,"and Ralph G. Newman, a Chicago book dealer and appraiser who "
3184,"had estimated the value of his papers for tax purposes, with having "
3185,engaged along with Morgan in a conspiracy to defraud the United 
3186,States. The indictment also charged DeMarco with making false 
3187,statements to IRS agents and with obstructing the Joint Committee’s 
3188,"inquiry, and Newman with assisting in the preparation of a false "
3189,"document filed with a tax return. After extensive legal argument, "
3190,including an unsuccessful mandamus petition by WSPF to the Court 
3191,"of Appeals, the defendants obtained separate trial settings, DeMarco "
3192,in Los Angeles and Newman in Chicago. As of the writing of this 
3193,"Report, the Los Angeles trial was scheduled for September 16 and "
3194,"the Chicago trial for October 28, 1975. "
3195,CAMPAIGN CONTRIBUTIONS 
3196,Investigations of 1972 Campaign Financing and Related Matters 
3197,"Beginning in June 1973, the Campaign Contributions task force "
3198,systematically examined the campaign finances of major 1972 Re- 
3199,publican and Democratic Presidential candidates. This examination 
3200,"included the investigation of several hundred separate transactions, "
3201,"including corporate and labor union contributions, recipients’ non- "
3202,"reporting of contributions and expenditures, and alleged quid pro quo "
3203,relationships between contributions and Government actions. 
3204,The task force began its inquiries on the basis of the following 
3205,major sources of information: 
3206,1. A list of persons who had made large contributions to President 
3207,"Nixon’s reelection campaign before April 7, 1972 — the effective date "
3208,of a new campaign law which required that contributions be reported 
3209,"publicly. The existence of this list, which was kept by the President’s "
3210,71
3211,"secretary, was initially disclosed in a civil suit brought by Common "
3212,Cause against the Finance Committee to Re-Elect the President 
3213,(FCRP). WSPF later obtained the list from the White House. 
3214,2. Reports of pre-April 7 contributions to several Democratic 
3215,"candidates, which the candidates had made public. "
3216,3. Reports of post-April 7 contributions to candidates of both 
3217,parties which had been filed with the General Accounting Office 
3218,pursuant to the new law. 
3219,4. Referrals from the Internal Revenue Service. 
3220,5. Information obtained in the Watergate investigation about 
3221,the sources and disposition of campaign funds used in the Watergate 
3222,break-in and cover-up. 
3223,"6. Newspaper articles, letters from citizens (many of them anony- "
3224,"mous), and similar sources. "
3225,A variety of investigative methods were used. The prosecutors 
3226,"interviewed major Republican and Democratic fundraisers, including "
3227,"Herbert Kalmbach of FCRP, who cooperated with the office under an "
3228,agreement involving his guilty plea to two charges (described else- 
3229,where in this section). Agents of the FBI and IRS examined the cam- 
3230,paign financial records of the major Presidential candidates and those 
3231,"Congressional candidates whose campaign finances, for various "
3232,"reasons, became relevant to matters directly within the jurisdiction "
3233,of the Special Prosecutor. The prosecutors sent letters to about 50 
3234,known contributors asking them to telephone the office and answer 
3235,certain questions. Many contributors were interviewed in person in 
3236,WSPF’s offices. FBI agents interviewed hundreds of employees and 
3237,financial officers of corporations and unions and examined bank and 
3238,corporate records; IRS agents took similar steps in cases that seemed 
3239,"to involve possible tax violations. In some cases, particularly when "
3240,there was a suspicion of an explicit quid pro quo relationship between 
3241,"contributions and Government actions, WSPF attorneys conducted "
3242,"interviews of contributors, fundraisers, and Government officials. "
3243,"Witnesses were also called before the grand jury, especially when it "
3244,appeared that attempts were being made to obstruct an investigation . 
3245,An important source of information in these inquiries was the dis- 
3246,closure by a number of corporations of their own illegal contributions. 
3247,"On July 6, 1973, American Airlines’ board chairman told WSPF and "
3248,publicly announced that the corporation had made an illegal contribu- 
3249,tion of corporate funds to the President’s re-election campaign. Special 
3250,Prosecutor Cox then issued a public invitation to other corporate 
3251,"executives to make similar disclosures, promising that: "
3252,[W]hen corporate officers come forward voluntarily and earty to 
3253,disclose illegal political contributions to candidates of either 
3254,"party, their voluntary acknowledgement will be considered as a "
3255,mitigating circumstance in deciding what charges to bring. 
3256,72
3257,Several corporations responded to this invitation shortly after it 
3258,"was issued, and others made similar disclosures in the ensuing months "
3259,(in some cases after learning that they were under investigation). The 
3260,corporations were required to disclose all corporate contributions to 
3261,candidates for Federal office within the period of the then statute of 
3262,limitations (1968-1973). The corporations were also required to dis- 
3263,close the basic method they had used to generate the contributed 
3264,"funds, including accumulations of cash in political “slush funds,” "
3265,"usually from overseas sources, and the use of bonus payments and "
3266,expense accounts to reimburse employees for contributions made in 
3267,their own names. Interviews were conducted to determine those cor- 
3268,"porate officers who were aware of, or authorized, the contribution and "
3269,also to learn what matters the corporation had pending before Federal 
3270,Government agencies. The prosecutors also investigated the possi- 
3271,bility of pressure on employees to donate to corporate “good Govern- 
3272,ment funds’ 7 which could be used to make otherwise legal political 
3273,contributions. In addition to the criminal charges WSPF brought 
3274,"against such corporate “volunteers,” other agencies such as IRS and "
3275,the Securities and Exchange Commission conducted investigations 
3276,and took action as a result of these disclosures to WSPF. 
3277,"On October 17, 1973, Cox announced an office policy on bringing "
3278,charges against corporate officers who had made voluntary disclosure 
3279,of corporate contributions: the corporation would be charged with 
3280,"violating Section 610 of Title 18 of the U.S. Code, which prohibits "
3281,"corporate contributions, and the primarily responsible corporate "
3282,officer would be charged under the same statute with consenting to 
3283,the making of such a contribution. The officer’s cooperation in bringing 
3284,the violation to WSPF’s attention would be reflected in a one-count 
3285,"misdemeanor charge of “non-willful” consent, as distinct from the "
3286,"felony of “willful” consent, and in a decision not to charge other "
3287,officers or include additional counts. Variations of this pattern would 
3288,"be based on unusual degrees of cooperation, on obstructive conduct, "
3289,or on other unique circumstances. The corporations which made 
3290,voluntary full disclosure of illegal contributions at a point when little 
3291,or no investigative work had been done regarding their activities 
3292,were charged and sentenced as follows : 
3293,"— On October 17, 1973, American Airlines pleaded guilty to a "
3294,"one-count violation of Section 610 and received a fine of $5,000. "
3295,The board chairman was not charged because he had been the first 
3296,"corporate officer to make such a disclosure, and had done so before "
3297,Cox had issued his invitation. 
3298,"— On the same date, Goodyear Tire and Rubber Company pleaded "
3299,"guilty to one count of violating Section 610 and was fined $5,000; "
3300,"the Chairman of Goodyear, Russell DeYoung, pleaded guilty to a "
3301,"one-count misdemeanor, Section 610 violation, and was fined $1,000. "
3302,73
3303,"— On the same date, Minnesota Mining and. Manufacturing Com- "
3304,pany pleaded guilty to a one-count Section 610 violation and was 
3305,"fined $3,000; the company’s chairman, Harry Heltzer, pleaded guilty "
3306,to a one-count misdemeanor of violating Section 610 and received a 
3307,$500 fine. 
3308,"— On November 12, 1973, Braniff Airways Inc., pleaded guilty to "
3309,"one count of violating Section 610 and was fined $5,000; Braniff’s "
3310,"chairman, Harding L. Lawrence, pleaded guilty to a one-count "
3311,"misdemeanor, Section 610 charge, and was fined $1,000. "
3312,"— On November 13, 1973, Ashland Petroleum Gabon Corp., a "
3313,"subsidiary of Ashland Oil, Inc., pleaded guilty to a one-count Section "
3314,"610 violation and was fined $5,000. Because his disclosure had closely "
3315,"followed American Airlines, Ashland’s chairman, Orin E. Atkins, "
3316,"was allowed to plead nolo contendere to a one-count Section 610, "
3317,"misdemeanor charge and was fined $1,000 "
3318,"— On the same date, Gulf Oil Corporation pleaded guilty to one "
3319,"count of violating Section 610 and received a $5,000 fine; Claude C. "
3320,"Wild, Jr., a vice-president of Gulf, pleaded guilty to a one-count "
3321,"misdemeanor under Section 610 and was fined $1,000. "
3322,"— On December 4, 1973, Phillips Petroleum Company pleaded "
3323,"guilty to one count of violating Section 610 and was fined $5,000; "
3324,chairman William W. Keeler pleaded guilty to a one-count mis- 
3325,"demeanor, Section 610 violation and received a $1,000 fine. "
3326,"— On December 19, 1973, Carnation Company pleaded guilty "
3327,"to a one-count Section 610 violation and was fined $5,000; its chairman, "
3328,"H. Everett Olson, pleaded guilty to a one-count misdemeanor viola- "
3329,"tion of Section 610 and received a $1,000 fine. "
3330,"— On March 7, 1974, Diamond International Corporation pleaded "
3331,"guilty to a one-count violation of Section 610 and received a $5,000 "
3332,"fine; Ray Dubrowin, the corporation’s vice president, pleaded guilty "
3333,"to a one-count misdemeanor under Section 610 and was fined $1,000. "
3334,"— On June 27, 1974, National By-Products, Inc., pleaded guilty "
3335,"to one count of violating Section 610 and was fined $1,000. The "
3336,responsible officer was not charged because the contribution had been 
3337,"very small, his disclosure had been motivated entirely by conscience, "
3338,"and under the circumstances of the contribution, success in an investi- "
3339,gation here had been highly unlikely. 
3340,"— On October 8, 1974, Greyhound Corporation pleaded guilty "
3341,"to a one-count, Section 610 violation and was fined $5,000. No corporate "
3342,officer was charged because there was substantial evidence that those 
3343,involved had believed their conduct to be legal and had relied on the 
3344,advice of counsel to that effect. 
3345,"— On December 30, 1974, Charles N. Huseman, of HMS Electric "
3346,"Corporation, pleaded guilty to a one-count violation of Section 610 "
3347,"as a misdemeanor and was fined $1,000. The corporation was not "
3348,74
3349,charged because it had been acquired by another corporation and 
3350,dissolved after the violation. 
3351,"— On January 28, 1975, Ratrie, Robbins, and Schweitzer, Inc. "
3352,pleaded guilty to a one-count Section 610 violation and was fined 
3353,"$2,500. Harry Ratrie and Augustus Robbins, III, each pleaded guilty "
3354,"to a one-count, Section 610 misdemeanor and received a suspended "
3355,sentence. Two officers were charged because they appeared to be 
3356,equally culpable. 
3357,"As the work of the task force progressed, it became clear that there "
3358,were different degrees of voluntary cooperation. The early volunteers 
