line,text
9127,that the price support increase had been directed for political reasons 
9128,rather than for the reasons made relevant by the applicable statute. 
9129,"In connection with that litigation, the plaintiffs had subpoenaed "
9130,various White House documents and a claim of executive privilege 
9131,had been interposed. Although the documents were made available 
9132,to the Civil Division of the Department of Justice in asserting and 
9133,"defending the claim of executive privilege, the White House refused "
9134,to allow the Special Prosecutor’s office access to those same documents. 
9135,This distinction between the Civil Division and the Special Prose- 
9136,cutor’s office — both units of the Department of Justice — pursuant to 
9137,m 
9138,"which one was relied upon to assert executive privilege, while that "
9139,"same claim was invoked against the other, was an important example "
9140,of the White House policy of non-cooperation with the Special Prose- 
9141,cutor’s investigations. 
9142,Cox met several times on this point with Richardson who indicated 
9143,that he was attempting to convince the White House legal staff that 
9144,"their position was untenable. On several occasions, Cox was told that "
9145,the White House had not finally turned down his requests but that 
9146,"special reviews were being conducted. On August 13, Cox wrote to "
9147,Richardson formally requesting access to the “Milk Documents” 
9148,which the White House had given to the Civil Division for the Nader 
9149,v. Butz suit. He explained that these were important to the criminal 
9150,"investigation and that, under the standing arrangement, the Special "
9151,Prosecutor’s office would not object to the Justice Department claims 
9152,of executive privilege in civil matters but the Special Prosecutor would 
9153,challenge such claims in criminal proceedings. Two days later Richard- 
9154,son told Cox that Buzhardt had instructed him not to turn over the 
9155,milk papers and that Richardson had asked him to reconsider that 
9156,order. Richardson asked Cox to delay pressing the issue to give him a 
9157,"chance to obtain reversal of it. It was not until November 1973, after "
9158,"Cox had been fired, that these papers were actually made available. "
9159,NATIONAL SECURITY 
9160,The difficult concept of “national security” was the subject of 
9161,intermittent and inconclusive discussions between the various At- 
9162,torneys General and Special Prosecutors. Although later evidence 
9163,documented that much of the purported concern raised by the White 
9164,House about “national security” was part of a plan to use that vague 
9165,"concept to frustrate legitimate investigations, the various Attorneys "
9166,"General and Special Prosecutors recognized that, as responsible public "
9167,"officials, they could not ignore legitimate requirements, both legal and "
9168,"practical, that sensitive defense and intelligence information be pro- "
9169,tected. A number of these meetings involved discussions (referred to 
9170,above) distinguishing possible criminal activities conducted in the 
9171,name of national security from those that could not or should not be 
9172,prosecuted. There were also efforts to ascertain with some precision 
9173,what the Department of Justice had offically sanctioned and what it 
9174,had not purported to allow in the name of “national security.” These 
9175,discussions eventually spanned the tenures of all three Special Prosecu- 
9176,tors and never produced a comprehensive statement from the Depart- 
9177,ment as to all prior practices or as to the full scope of past or current 
9178,policies concerning “national security” operations. 
9179,"Finally, there were discussions about the difficulties that would "
9180,emerge in prosecutions where either the government or the defense 
9181,attorneys might need to present highly sensitive defense information in 
9182,m 
9183,public proceedings. It was understood from the outset that the Special 
9184,Prosecutor would attempt to frame the legal theories of prosecution 
9185,and the presentation of evidence in order to obviate the need for either 
9186,the Government or the defense to utilize any such information. At 
9187,various points both Special Prosecutors Cox and Jaworski were ad- 
9188,vised of such potential problems by either the Attorney General or 
9189,the White House. When classified information was needed for trial at 
9190,"later dates, WSPF adopted the usual Federal executive practice of "
9191,asking the classifying agency to declassify any document needed for 
9192,"trial. Although no insuperable problems ever, in fact, occurred, Cox "
9193,recognized in the early months of WSPF's existence that legitimate 
9194,national security concerns might force the voluntary dismissal of a 
9195,case if classified material necessary either to the prosecution or defense 
9196,"could not legitimately be declassified, or even made available to a "
9197,judge for decision about possible disclosure to the defense at trial. 
9198,ATTORNEY GENERAI/S POWERS 
9199,The final major subject of contacts between the Attorney General 
9200,and the Special Prosecutor involved matters where action by the 
9201,"Attorney General personally was necessary. For example, under the "
9202,"“use immunity” statute, 18 U.S.C. § 6001 et seq., applications for "
9203,court orders granting immunity in the face of a claim of the privilege 
9204,"against self-incrimination must be approved by the Attorney General, "
9205,"by his Deputy, or by a designated Assistant Attorney General. Al- "
9206,though the Special Prosecutor had been delegated powers comparable 
9207,"to those of the Attorney General and an Assistant Attorney General, "
9208,there was concern that the express reference in the statutes to specific 
9209,officials who are selected by the President and confirmed by the 
9210,Senate might not properly be extended to an official like the Special 
9211,Prosecutor who was appointed by the Attorney General. This problem 
9212,was specifically acute since the Justice Department at that time was 
9213,attempting to convince the Supreme Court in the case of United States 
9214,"v. Giordano, 416 U.S. 505 (1974), that similar references in the Federal "
9215,wiretap statute should be read to allow other Justice Department 
9216,officials to exercise certain powers. (The Supreme Court subsequently 
9217,ruled unanimously that only the officials referred to in that statute 
9218,"could validly act.) For this reason, a procedure was established under "
9219,which the Special Prosecutor requested that the Attorney General 
9220,"approve applications for immunity, and the official certification of "
9221,approval was made by the Attorney General. No problems ever were 
9222,encountered in the implementation of this practice. 4 
9223,"4 In a related arrangement, the Special Prosecutor’s office and the Criminal "
9224,Division “Immunity Unit” regularly consulted about proposed immunity orders 
9225,to insure that neither the Justice Department’s operating divisions nor the Special 
9226,Prosecutor’s office unwittingly granted immunity to a person under active investi- 
9227,gation by the other. 
9228,203
9229,Access to tax returns also required involvement of the Attorney 
9230,General since under the Internal Revenue Code 5 and the imple- 
9231,"menting executive order, only the Attorney General, Deputy Attorney "
9232,"General, an Assistant Attorney General or a United States Attorney — "
9233,officials appointed by the President and confirmed by the Senate — 
9234,could apply for access to tax returns as part of the investigative 
9235,"process. Early in the Special Prosecutor's term, he requested that the "
9236,Secretary of the Treasury arrange to amend the operative executive 
9237,order to authorize the Special Prosecutor to obtain access to tax 
9238,"returns directly. This request was held up for several months, and "
9239,on several occasions Richardson and Cox met to discuss how the 
9240,"Attorney General might resolve this issue, inasmuch as the White "
9241,House apparently would not process the amendment to the executive 
9242,order. No resolution was achieved prior to the resignation of Richard- 
9243,"son and the dismissal of Cox. After the dismissal, Special Prosecutor "
9244,Jaworski continued to pursue this issue and ultimately decided to 
9245,submit requests for tax information through the Attorney General 
9246,who forwarded them as a matter of course to the Internal Revenue 
9247,"Service. An amendment to the Treasury Regulations, or modification "
9248,"of the executive order, was not necessary, and in every instance the "
9249,Special Prosecutor received the requested materials without delays. 
9250,CONCLUSION 
9251,"Following the dismissal of Special Prosecutor Cox on October 20, "
9252,"1973, the nature and number of contacts between the new Special "
9253,Prosecutors and new Attorneys General declined sharply for several 
9254,reasons. One was the uniqueness of the pre-existing relationship 
9255,"between Attorney General Richardson and Special Prosecutor Cox, "
9256,which enabled them to deal with each other regularly and easily. 
9257,"In addition, after the discussions in the formative months of the "
9258,"Special Prosecutor's office, most of the structural issues had been re- "
9259,"solved, and questions about the contours of jurisdiction were no "
9260,"longer as significant. Most importantly, the public and congressional "
9261,"reaction to the dismissal of Cox, and to the White House effort to "
9262,"override his independence and to undercut his judgment, would have "
9263,made it very difficult as a political or policy matter for subsequent 
9264,Attorneys General to assume any significant role in directly ques- 
9265,tioning the Special Prosecutors' judgments or even raising issues 
9266,about them. 
9267,5 26 U.S.C. 6103(a); 26 C.F.R. § 301. 6103(a)-! (g). 
9268,204
9269,Appendix E: 
9270,Relations With 
9271,Congressional Committees 
9272,INTRODUCTION 
9273,This Appendix describes the continuing relationships that WSPF 
9274,developed with the Senate Select Committee on Presidential Campaign 
9275,"Activities, and the Senate and House Committees on the Judiciary. "
9276,The relationship with the Senate Select Committee (SSC) arose from 
9277,mutual needs to share information and coordinate often parallel 
9278,investigations. WSPF’s dealings with the House and Senate Judiciary 
9279,Committees grew from the confirmation hearings in which Richardson 
9280,"pledged to establish WSPF. Later, after Cox’s firing the Committee’s "
9281,consideration of various legislative proposals for a special prosecutor 
9282,resulted in the Congressional protection of WSPF’s existence and inde- 
9283,pendence after its reestablishment. 1 
9284,"In addition to these ongoing relationships, WSPF had intermittent "
9285,contact with the Congressional committees that conducted inquiries on 
9286,"matters related to WSPF’s work. Beginning in late May 1973, a "
9287,WSPF staff attorney was assigned to identify and acquire transcripts 
9288,of Congressional hearings on matters of interest to the Special Prose- 
9289,cutor. These eventually included hearings from the following: (1) the 
9290,Senate Select Committee on Presidential Campaign Activities; 
9291,(2) the Senate Appropriations Subcommittee on Intelligence Opera- 
9292,tions (regarding CIA assistance to the Plumbers and involvement in 
9293,the burglary of Ellsberg’s psychiatrist’s office and in the Watergate 
9294,cover-up) ; (3) the Senate Appropriations Subcommittee on Housing 
9295,"and Urban Development, Space, Science, Veterans and other inde- "
9296,pendent executive agencies (regarding the SEC investigation into the 
9297,activities of Robert Vesco) ; (4) the Senate Armed Services Committee 
9298,1 Cooperation between WSPF and the House Judiciary Committee’s impeach- 
9299,ment inquiry staff is described in Chapter 4 of this Report. Appendix B discusses 
9300,the consideration in 1973 of proposals for a legislatively-created special prosecutor. 
9301,"In July 1975, Special Prosecutor Ruth and former Special Prosecutor Jaworski "
9302,testified before the Senate Committee on Government Operations to oppose a bill 
9303,"that would create, in effect, a permanent special prosecutor. "
9304,205
9305,591-439 0 - 75 - 14 
9306,(regarding CIA involvement in domestic intelligence activities); 
9307,"(5) the Senate Commerce Committee (confirmation of Egil Krogh, "
9308,former head of the Plumbers) ; (6) the Senate Foreign Relations Com- 
9309,"mittee (confirmation of Richard Helms, former head of the CIA); "
9310,(7) the Senate Judiciary Committee (regarding ITT and the Richard 
9311,Kleindienst confirmation hearings and regarding the Watergate 
9312,cover-up in the L. Patrick Gray confirmation hearings) ; (8) the House 
9313,Commerce Committee’s Special Subcommittee on Investigations 
9314,(regarding the SEC’s role in the Vesco and ITT matters). WSPF also 
9315,received staff reports from the House Committee on Banking and 
9316,"Currency regarding, among other things, financial aspects of the "
9317,Watergate burglary. The House Armed Services Subcommittee on 
9318,"Intelligence, which had held hearings on CIA involvement in the "
9319,"burglary of Ellsberg’s psychiatrist’s office and the Watergate cover-up, "
9320,originally refused to provide transcripts of its executive session 
9321,hearings. 
9322,"In addition to these sources of information, in April 1974 the "
9323,Joint Committee on Internal Revenue Taxation released a report on 
9324,President Nixon’s tax returns from 1969 through 1972. The report 
9325,was useful to the attorneys from the Special Prosecutor’s office who 
9326,were investigating charitable contribution tax deductions taken by 
9327,"Nixon for his gift of pre-Presidential papers. Also, the staff of the "
9328,Joint Committee cooperated fully with the WSPF attorneys in their 
9329,investigation. 
9330,"As investigations led to prosecutions, the Special Prosecutor’s office "
9331,had to comply with the legal requirement of supplying defense counsel 
9332,with prior statements made by prospective trial witnesses on topics 
9333,they would testify to at trial and any evidence in the Government’s 
9334,possession which tended to exculpate the defendant. Although he was 
9335,convinced that this requirement did not extend to Congressional 
9336,"testimony, the Special Prosecutor, in an effort to be as complete as "
9337,"possible, wrote to a number of Congressional committees requesting "
9338,that they turn over to the prosecutors any relevant executive session 
9339,testimony or staff interviews that they possessed on matters approach- 
9340,ing trial. Most of the committees immediately supplied the relevant 
9341,material in their possession. The House Armed Services Committee 
9342,eventually agreed to provide executive session material of witnesses 
9343,who testified before the Subcommittee on Intelligence relative to the 
9344,Subcommittee’s inquiry into the alleged involvement of the CIA in the 
9345,Watergate and Ellsberg break-ins. The testimony was made available 
9346,for the Watergate cover-up trial. 
9347,"In a few instances, members of Congress and Congressional com- "
9348,mittees referred matters to the Special Prosecutor’s office for in- 
9349,vestigation. Any such allegation that merited full investigation was 
9350,fully pursued. Others either did not fall within WSPF’s jurisdiction 
9351,"or proved to lack potential after initial inquiry. In one instance, a "
9352,206
9353,referral by a committee resulted directly in a conviction. On Septem- 
9354,"ber 10, 1973, after G. Gordon Liddy refused to be sworn in to testify "
9355,before the House Armed Services Committee’s Subcommittee on In- 
9356,"telligence, the House of Representatives voted to cite Liddy for "
9357,contempt of Congress. The case was referred by the U.S. Attorney for 
9358,the District of Columbia to WSPF. Liddy was subsequently indicted 
9359,"on March 7, 1974, for refusing to testify or produce papers before a "
9360,"Congressional committee, and he was found guilty on May 10, 1974. "
9361,The Senate Select Committee on 
9362,Presidential Campaign Activities 
9363,The Senate Select Committee on Presidential Campaign Activities 
9364,(SSC) was established approximately three months prior to the 
9365,appointment of the Watergate Special Prosecutor. Widespread allega- 
9366,tions of executive misconduct had led the Senate to vote unanimously 
9367,for the creation of a select committee to investigate the Watergate 
9368,"break-in and cover-up, campaign practices and financing, and "
9369,campaign espionage during the 1972 Presidential campaign. 2 
9370,The Committee’s initial dealings with the Department of Justice 
9371,involved requests for access to FBI investigative reports on the 
9372,"Watergate investigation, summaries of which were provided, and "
9373,notices of intent to apply for court orders requiring witnesses to 
9374,testify before the Committee. 3 This caused considerable concern 
9375,to the prosecutors investigating the Watergate case because any 
9376,testimony or evidence obtained directly or indirectly therefrom could 
9377,not be used against the witness in future prosecutions. A failure to 
9378,prove no “taint” would result in the case being dropped. The SSC’s 
9379,decision to allow live television coverage of the hearings intensified 
9380,the difficulty of such proof and raised the problem of a future claim 
9381,by defendants that pre-trial publicity prevented the empanelling 
9382,of an unbiased jury and the assurance of a fair trial. 
9383,"The SSC public hearings opened on May 17, 1973, a week before "
9384,Cox was sworn in as Special Prosecutor. Cox was immediately faced 
9385,with the problem of publicity generated by the SSC’s hearings and the 
9386,2 The Senate Select Committee on Presidential Campaign Activities was 
9387,"established under Senate Resolution 60, dated February 7, 1973. "
9388,"3 Under Federal law, a Congressional committee wishing to obtain testimony "
9389,from a witness who refuses to testify on the grounds of his Fifth Amendment 
9390,privilege against self-incrimination must notify the Attorney General ten days 
9391,before seeking a court order compelling the witness to testify. The Attorney 
9392,General cannot prevent the Committee from seeking the order but can ask the 
9393,court for a delay of up to 20 days. When the Committee makes its application 
9394,"to the court, and the court finds that the Attorney General has not exercised "
9395,"his delay option or has done so and 20 days have expired, the court will order "
9396,the witness to testify. The witness is thus “immunized” from any use of his 
9397,testimony against him in criminal investigations or prosecutions. 
9398,207
9399,effect this would have on his criminal investigations and subsequent 
9400,"indictments. On June 2, 1973, the Special Prosecutor met with "
9401,Senator Ervin to request that the SSC temporarily suspend public 
9402,"hearings. Cox then expressed his concern in a June 4, 1973, letter "
9403,to Senator Ervin and requested that the Committee consider two 
9404,"important points: one, the danger that pre-trial publicity might "
9405,"interfere with fair trials; and two, the risk that the Senate Com- "
9406,mittee’s granting immunity to major potential defendants would 
9407,"bar successful prosecution. Senator Ervin responded in a June 5, "
9408,"1973, letter stating that the public hearings would continue. "
9409,"By this time, the SSC had applied to the District Court for orders "
9410,requiring John Dean and Jeb Stuart Magruder to testify. Both Dean 
9411,and Magruder were viewed by Cox as potential defendants. Ervin’s 
9412,letter led the Special Prosecutor to request that the District Court 
9413,impose conditions on these immunity orders. Suggested conditions 
9414,included requiring the exclusion of the broadcast media when Dean 
9415,and Magruder were to testify or taking their testimony in executive 
9416,session. The SSC argued that it was not within the court’s power to 
9417,impose conditions upon the grant of an immunity order. The court 
9418,"ruled that, since its duties in this regard were purely ministerial, it "
9419,had no choice but to grant the Committee’s request. 4 Cox announced 
9420,"that he would not appeal the District Court order, but on June 19, "
9421,"1973, prior to Dean’s testimony before the SSC, he filed with the court "
9422,a list of all the evidence against Dean that had been compiled pre- 
9423,viously by the U.S. Attorneys and WSPF. This was done to protect 
9424,WSPF against future claims by Dean concerning the validity of an 
9425,indictment or admissibility of evidence on the ground that such indict- 
9426,ment or evidence was derived directly or indirectly from testimony 
9427,compelled by the SSC. No “ taint” papers were filed in regard to 
9428,Magruder because he had already agreed with the U.S. Attorneys 
9429,to plead guilty to a one-count information on his involvement in the 
9430,Watergate matter. 
9431,"On June 5, 1973, the Senate Select Committee filed with the court "
9432,a notice of intent to apply for an order conferring immunity and 
9433,compelling the testimony of Gordon Strachan. In an accompanying 
9434,"letter to the Attorney General, Majority Counsel Sam Dash requested "
9435,a waiver of the 10-day notice period as well as the additional 20-day 
9436,"extension granted by law. Richardson referred the matter to Cox, "
9437,as the Attorney General had already delegated to the Special Prose- 
9438,cutor his authority over immunity applications by the SSC. 
9439,"On June 8, 1973, Cox’s assistants, James Neal and James Voren- "
9440,"berg, discussed with Dash and Minority Counsel Fred Thompson the "
9441,"Special Prosecutor’s concerns about immunizing Strachan, stating "
9442,4 Application of U.S. Senate Select Committee on Presidential Campaign 
9443,"Activities, 361 F. Supp. 1270 (D.D.C. 1973). "
9444,that more investigation was needed before they would be able to 
9445,determine if Strachan was a potential defendant. Time was also needed 
9446,to isolate the evidence against Strachan as was being done with respect 
9447,to Dean. It was agreed that since the SSC would not schedule 
9448,"Strachan’s testimony for about a month, WSPF would invoke the "
9449,20-day extension granted by law and take the matter up at the end of 
9450,"that period. On July 5, the Special Prosecutor notified the District "
9451,Court that WSPF was not opposed to the SSC's request for an order 
9452,compelling Strachan to testify and the court granted the order on 
9453,"July 6, 1973. Prior to Strachan's testimony before the SSC, the Special "
9454,Prosecutor filed with the court a list of the evidence against him com- 
9455,piled by WSPF. 
9456,In regard to those witnesses who were testifying before the Select 
9457,Committee without grants of immunity and who were viewed by 
9458,"WSPF as potential defendants, Cox suggested in a letter to Senator "
9459,Ervin (concerning the SSC's scheduling of John MitchelPs testimony) 
9460,that the Committee advise the witness of his status in the investiga- 
9461,"tion, inform him of his rights and make it clear that “any testimony "
9462,that he gives . . . without invoking his privilege against self- 
9463,incrimination under the Fifth Amendment to the United States Con- 
9464,stitution constitutes a waiver of that privilege” and that the waiver 
9465,was not the result of compulsion. 
9466,"After Alexander Butterfield testified before the SSC on July 16, "
9467,"1973, about the existence of the White House taping system, the "
9468,Special Prosecutor and Senate Select Committee both subpoenaed 
9469,tapes of certain conversations that they felt were vital to their Water- 
9470,gate investigations. The President refused to comply with the sub- 
9471,poenas and both the Special Prosecutor and the SSC initiated litigation 
9472,"to force compliance. In an August 22, 1973, letter to Judge Sirica, "
9473,"Sam Dash attempted to have the SSC's case ( SSC v. Nixon, CA "
9474,1593-73) and the Special Prosecutor's case (In Re Grand Jury Sub- 
9475,"poena Duces Tecum Issued to Richard Nixon, Misc. No. 47-73) con- "
9476,"sidered together. Both Cox and the President's counsel, Charles Alan "
9477,"Wright, noting the differences between the two cases on central issues, "
9478,opposed the Committee's request. Since the District Court had already 
9479,"scheduled a hearing for August 22 on Cox's case, the Special Prosecutor "
9480,was also concerned about possible delay in grand jury proceedings. 
9481,The District Court decided not to consider the cases jointly and 
9482,"on October 17, 1973, dismissed the Committee's suit for lack of "
9483,jurisdiction. 
9484,Representatives of the Senate Select Committee were then drawn 
9485,into the dispute over the President's insistence that the courts could 
9486,not order him to provide tapes subpoenaed from the White House by 
9487,"the Special Prosecutor. On October 19, 1973, the same day the Com- "
9488,mittee filed an appeal from the District Court's dismissal of their 
9489,"tapes suit and the day before the Special Prosecutor was fired, Senators "
9490,209
9491,Ervin and Baker were called to the White House to meet with the 
9492,President and his counsel. The President first met with Baker alone 
9493,and then met with Baker and Ervin to discuss a solution to the tapes 
9494,"issue. After the meetings, the President announced that Cox had "
