line,text
5970,position in which I lack faith or which my judgment dictates 
5971,is not supported by probable cause. The provision in the Constitu- 
5972,"tion investing the President with the right to grant pardons, "
5973,and the recognition by the United States Supreme Court that 
5974,"a, pardon may be granted prior to the filing of charges are so clear, "
5975,"in my opinion, as not to admit of doubt. Philip Lacovara, then "
5976,"Counsel to the Special Prosecutor, by written memorandum on "
5977,"file in this office, came to the same conclusion, pointing out that : "
5978,. . the pardon power can be exercised at any time after 
5979,a federal crime has been committed and it is not necessary that 
5980,"there be any criminal proceedings pending. In fact, the pardon "
5981,power has been used frequently to relieve federal offenders of 
5982,criminal liability and other penalties and disabilities attaching 
5983,to their offenses even where no criminal proceedings against the 
5984,individual are contemplated.” 
5985,"I have also concluded, after thorough study that there is "
5986,nothing in the charter and guidelines appertaining to the office 
5987,of the Special Prosecutor that impairs or curtails the President's 
5988,free exercise of the constitutional right of pardon. 
5989,I was co-architect along with Acting Attorney General Robert 
5990,"Bork, of the provisions some theorists now point to as inhibiting "
5991,the constitutional pardoning power of the President. The additional 
5992,safeguards of independence on which I insisted and which 
5993,"Mr. Bork, on former President Nixon's authority, was willing to "
5994,grant were solely for purposes of limiting the grounds on which 
5995,my discharge could be based and not for the purpose of enlarging 
5996,on the jurisdiction of the Special Prosecutor. 
5997,Hearings held by the Senate Judiciary Committee subsequent 
5998,to my appointment make it clear that my jurisdiction as Special 
5999,Prosecutor was to be no different from that possessed by my 
6000,predecessor. 
6001,There was considerable concern expressed by some Senators 
6002,"that Acting Attorney General Bork, by supplemental order, in- "
6003,advertently had limited the jurisdiction that previously existed. 
6004,The hearings fully developed the concept that the thrust of the 
6005,new provisions giving me the aid of the Congressional “consensus” 
6006,committee were to insulate me from groundless efforts to terminate 
6007,my employment or to limit the jurisdiction that existed. It was 
6008,"made clear, however, that there was no “redefining” of the juris- "
6009,diction of the Special Prosecutor as it existed from the beginning. 
6010,There emerged from these hearings the definite understanding that 
6011,in no sense were the additional provisions inserted in the Special 
6012,Prosecutor's Charter for the purpose of either enlarging or diminish- 
6013,132
6014,"ing his jurisdiction. I did stress, as I argued in the Supreme Court "
6015,"in U.S . v. Nixon , that I was given the verbal assurance that I "
6016,"could bring suit against the President to enforce subpoena rights, "
6017,"a point upheld by the Court. This, of course, has no bearing on the "
6018,pardoning power. 
6019,"I cannot escape the conclusion, therefore, that additional "
6020,provisions to the Charter do not subordinate the constitutional 
6021,pardoning power to the Special Prosecutor's jurisdictional rights. 
6022,For me now to contend otherwise would not only be contrary to 
6023,the interpretation agreed upon in Congressional hearings — it also 
6024,"would be, on my part, intellectually dishonest. "
6025,"Thus, in light of these conclusions, for me to procure an indict- "
6026,ment of Richard M. Nixon for the sole purpose of generating a 
6027,"purported court test on the legality of the pardon, would consti- "
6028,"tute a spurious proceeding in which I had no faith; in fact, it "
6029,would be tantamount to unprofessional conduct and violative of 
6030,my responsibility as prosecutor and officer of the court. 
6031,133
6032,Concluding Observations 
6033,and Recommendations 
6034,"Normally when prosecutors are asked to recommend reforms, the "
6035,questions are limited to the criminal justice system. But most of what 
6036,WSPF personnel experienced in criminal justice was dramatically 
6037,atypical of criminal justice generally. The prosecutors had adequate 
6038,resources; defendants were not jailed for long periods of time prior to 
6039,trial; the courts had time and resources to meet all the demands of 
6040,"Watergate litigation in a detached, unhurried atmosphere; private "
6041,defense counsel brought all their skills to thorough pretrial investiga- 
6042,"tion, legal attack, trial strategy and fully-briefed appeals; the sections "
6043,of Federal prisons in which convicted Watergate defendants served 
6044,"their terms all lacked the small, inhuman spaces in which most Ameri- "
6045,"can criminals reside, locked into their idleness for 17 hours each day; "
6046,and constant press and public scrutiny provided a careful watchdog to 
6047,make sure that Government investigations proceeded without abuse 
6048,of power or undue leniency. Watergate did not educate American 
6049,"citizens about the normal, day-to-day criminal justice process. "
6050,"In considering what recommendations to include in this report, "
6051,WSPF concentrated on what it did observe: criminal abuse of power 
6052,by Government officials in high places ; historical growth of secrecy in 
6053,the Federal executive branch unchecked by Americans and their 
6054,"elected Congress; unchallenged, subjective judgments by the executive "
6055,branch in identifying persons and organizations that constitute an 
6056,impermissible threat to the national interest and to executive policy; 
6057,"an undemocratic condition wherein money is power, and skillful, "
6058,"cynical public relations cements that power; and finally, a silent, "
6059,"sometimes grudging, sometimes willful conclusion by some Govern- "
6060,ment representatives that ethical standards are irrelevant because 
6061,"quick implementation of policy goals is mandatory, but achievable "
6062,only by social and personal injustices to others. 
6063,These conclusions all arose from observing how Government 
6064,officials and agencies actually grapple with the legitimate demands 
6065,upon them. The demands of national security require extraordinary 
6066,judgment. The separation of powers concept requires judicious use of 
6067,the privilege doctrine. Politicians cannot be elected without extensive 
6068,campaign funds and loyal friends who want rewards. Individual 
6069,m 
6070,requirements for personal success seem always to demand that one 
6071,must “ride with the system.” And a leader hoping to implement his 
6072,policies is loathe to choose anyone whose independence or unpredict- 
6073,able mind may eventually undermine or delay those goals. 
6074,"These demands have always had, and will continue to have, in- "
6075,herent potential for abuse of power. National security can easily be 
6076,"used to justify unconstitutional actions, and executive privilege can "
6077,then be invoked to justify the failure to disclose these actions. Sub- 
6078,jective distrust can be identified mistakenly with a national need 
6079,that justifies massive intelligence systems with permanent storage 
6080,"and illicit use of personal information. Political survival, rationalized "
6081,"by one’s perceived ability to accomplish the national will, can too "
6082,easily justify the acceptance of “big money” and the granting of 
6083,instant access to any friend of one’s cause or one’s administration. The 
6084,leader who sets out to accomplish his goals may appoint as executives 
6085,only those who helped him along the political path and who will 
6086,give him support that disregards independent analysis or the demands 
6087,of personal will and courage. 
6088,"This brief and, by no means, original or exclusive catalog should "
6089,sound familiar to all readers of this report. Many of the Watergate 
6090,phenomena had their historical precedents. Many had grown with no 
6091,deterrence from other branches of Government. Others had grown 
6092,without questions from the people and from the press. Watergate 
6093,should not be analyzed merely in the context of each individual 
6094,abuse of power that prosecutors were told to investigate. As with 
6095,"any coalescing of activities that lead to a national crisis, so too did "
6096,Watergate grow from historical roots that presaged abuses of institu- 
6097,tional power. 
6098,If Watergate was an insidious climax to recent and hitherto subtle 
6099,"historical trends, the formulation of recommendations must begin with "
6100,"the simple, but basic, observation that democracies do not survive "
6101,unless elected officials do what they are supposed to do and citizens 
6102,maintain vigilance to see that they do. The public unfolding of Water- 
6103,"gate abuses resulted from citizen, press and official actions. Nothing "
6104,can replace that kind of vigilance; and recommendations for new laws 
6105,"or new institutions are insignificant when compared to the stubborn, "
6106,"plodding, daily work of Americans and their elected representatives "
6107,in watching over and channeling the power of their national Govern- 
6108,"ment, the power of concentrated wealth, the power of officially spoken "
6109,"and written words, and the power of secret bureaucracies. "
6110,As prosecutors searching only for facts that disclose or disclaim 
6111,"criminal activity, WSPF lacks the expertise to propose a broad base "
6112,of political and social change. The recommendations that follow are 
6113,not so intended. The proposals are modest but their implementa- 
6114,tion would probably help. Most appear easy and obvious. But that is 
6115,a good way to start testing a Nation’s willingness to learn from its past. 
6116,135
6117,RECOMMENDATIONS 
6118,Protecting the Integrity and Effectiveness of the Prosecution Function 
6119,"The integrity of Government officials, from the President down, "
6120,depends in part on the credibility of criminal statutes as a deterrent 
6121,to misconduct. This credibility in turn depends on the capacity of 
6122,the system of justice to investigate and prosecute wrongdoing wherever 
6123,"it occurs. At a minimum, this means that the Department of Justice "
6124,must be capable of exercising it prosecution functions free of undue 
6125,"influence or conflicts of interest. At the same time, many of the "
6126,functions of the Department are legitimate subjects of Presidential 
6127,"concern on a policy level, and the President needs as Attorney General "
6128,a legal adviser in whom he has full confidence. Tf the Department is 
6129,properly insulated from partisan politics and from service to an 
6130,"Administration's purely political interests, it would not seem neces- "
6131,sary to take the major institutional steps of making the Attorney 
6132,General's office elective or creating a permanent special prosecutor's 
6133,office. 
6134,Independence oj Department of Justice Officials. The President 
6135,should not nominate and the Senate should not confirm as Attorney 
6136,"General, or as any other appointee in high Department of Justice "
6137,"posts, a person who has served as the President's campaign manager "
6138,or in a similar high-level campaign role. A campaign manager seeks 
6139,support for his candidate and necessarily incurs obligations to political 
6140,leaders and other individuals throughout wide geographical areas. If 
6141,"he then takes a high position in the Justice Department, he may take — "
6142,or appear to take — official actions on the basis of those commitments 
6143,rather than on appropriate legal and policy grounds. The Attorney 
6144,General and other Justice Department appointees should be lawyers 
6145,"with their own reputations in the legal profession, with capacity and "
6146,"willingness to make independent judgments, and with the authority "
6147,to choose similarly qualified persons for subordinate positions. In 
6148,"advising and consenting on Presidential nominees, Senators should "
6149,apply to Justice Department appointees standards of character and 
6150,independence similar to those they apply to nominees for the Supreme 
6151,Court. Similar standards should attach to the appointment and 
6152,confirmation of United States Attorneys. 
6153,"The Hatch Act, which prohibits most Federal employees from "
6154,"taking an active part in political management or campaigns, should "
6155,"be amended to apply to all employees of the Department of Justice, "
6156,"including the Attorney General . 1 However, the amendment should "
6157,make clear that high Department officials are not violating the 
6158,1 Current penalty provisions may not be suited to such a revision. If an 
6159,"amendment is contemplated, thought must be given to appropriate sanctions for "
6160,violations. 
6161,136
6162,prohibition of political activity when they discuss and defend De- 
6163,partment policies and actions on their merits in public forums. 
6164,"Contacts About Pending Cases. In August 1973, Attorney General "
6165,"Richardson issued Order No. 532-73, requiring all Justice Department "
6166,employees to record in memorandum form each oral communication 
6167,“concerning a case or other matter pending before the Department 
6168,with a non-involved party indicating an interest in the case or matter.” 
6169,This order was meant to deter improper contacts by creating a written 
6170,record of any attempt to influence Department handling of cases. 
6171,Subsequent debate within the Department of Justice has questioned 
6172,the breadth of the order and the lack of an enforcement mechanism. 
6173,"For example, the memorandum as now written could include casual "
6174,social contacts in which a total stranger voices a citizen view about 
6175,a pending Department matter. 
6176,The Attorney General should resolve these problems of coverage 
6177,and reissue the Order. Attempted political persuasion and other 
6178,"efforts by non-involved parties to secure direct, out-of-channel access "
6179,to Department personnel should all be part of official records. 
6180,Increased Federal Efforts Against Corruption Without Creation of a 
6181,Permanent Special Prosecutor . The Senate Select Committee reacted 
6182,to their Watergate hearings by recommending the creation of a 
6183,permanent special prosecutor’s office. The proposed new officer would 
6184,be appointed by the judiciary and confirmed by the Senate. He would 
6185,be independent of the Attorney General in making all his decisions 
6186,and have jurisdiction over most corrupt acts committed b}^ Federal 
6187,employees and also over political campaign crimes. 
6188,The principal reason cited for such an institution is the perceived 
6189,incapacity of the Justice Department to investigate fully allegations 
6190,of criminal conduct by high officials. Since the Attorney General is 
6191,"a Presidential appointee, it is argued, his subordinates cannot be "
6192,expected to seek or uncover misconduct by high officials whose prose- 
6193,"cution might embarrass the President. The problem is most acute, of "
6194,"course, when the alleged wrongdoer is the President himself ; but it is "
6195,substantial when the subject of investigation is a Presidential appointee 
6196,at any level. Justice Department investigators may be equally 
6197,frustrated in efforts to prosecute the President’s judicial appointees or 
6198,political allies in Congress; even members of Congress who belong to 
6199,the opposing party may be immune from prosecution because of a 
6200,“live and let live” political tradition that survives changes of Adminis- 
6201,tration and protects politicians even after they leave office. An 
6202,"independent special prosecutor, not subject to such considerations, "
6203,would pursue wrongdoing in Government solely on an objective 
6204,basis. 
6205,No one who has watched “Watergate” unfold can doubt that the 
6206,Justice Department has difficulty investigating and prosecuting high 
6207,"officials, or that an independent prosecutor is freer to act according "
6208,137
6209,to politically neutral principles of fairness and justice. But the question 
6210,is whether such independence should be institutionalized on a perma- 
6211,nent basis. Do the advantages of such a step outweigh its disadvan- 
6212,tages? 
6213,WSPF is opposed to the idea of extending the special prosecutor 
6214,concept on a permanent basis. Central to the question is the fact that 
6215,such a public officer would be largely immune from the accountabilit}^ 
6216,that prosecutors and other public officials constantly face. Lack of 
6217,accountability of an official on a permanent basis carries a potential 
6218,for abuse of power that far exceeds any enforcement gains that might 
6219,ensue. An independent prosecutor reports directly on ongoing investi- 
6220,"gations to no one, takes directions from no one and could easily abuse "
6221,his power with little chance of detection. Although matters that reach 
6222,court obviously invoke court control over a prosecutor’s public con- 
6223,"duct, the discretionary process of initiating and conducting investi- "
6224,"gations bears great potential for hidden actions that are unfair, "
6225,"arbitrary, dishonest, or subjectively biased. "
6226,"Ordinarily, prosecutors are accountable either directly to the "
6227,electorate or indirectly through the elected officials who appoint 
6228,"them. Under proposed legislation, a permanent special prosecutor "
6229,would not be subject to such accountability. In extraordinary situa- 
6230,"tions such as “Watergate,” an independent prosecutor can be held "
6231,accountable directly to the public because his actions are subject to 
6232,intense and continuous press scrutiny. But such high visibility cannot 
6233,be expected for a permanent office dealing day to day with less explo- 
6234,sive matters. 
6235,Much of the Watergate and preceding abuses resulted from the 
6236,public’s delegation of public responsibilities to powerful men whose 
6237,judgments were trusted and whose claimed need for secrecy was 
6238,always accepted. Men with unchecked power and unchallenged trust 
6239,too often come to believe that their own perceptions of priorities and 
6240,the common good coincide with the national will. There is no reason 
6241,"to believe that, in the long run, an independent special prosecutor’s "
6242,office would avoid this status. 
6243,Other problems exist. Anyone who has observed bureaucracies 
6244,realizes that a “special” organization rarely retains its “special” 
6245,"qualities beyond a 3-year period. New organizations, large or small, "
6246,"start with a burst of speed, energy, imagination, enthusiasm, flexibility, "
6247,"long daily hours, and almost uniform high quality of personnel. That "
6248,level is hardly ever maintained over a long period by a permanent 
6249,organization in either the public or private sector. This is a problem 
6250,"for Government generally and should be addressed as such, not just "
6251,as to law enforcement. But there is no reason to believe that a per- 
6252,manent special prosecutor’s office would be immune from the rigidity 
6253,"that comes over most organizations after the initial period. Indeed, "
6254,this would probably happen to the Watergate Special Prosecution 
6255,138
6256,Force if it were to continue beyond the period in which it has been 
6257,"needed. Such rigidity is especially likely, and especially harmful, in "
6258,an agency that is as upaccountable as a permanent special prosecutor 
6259,would be. 
6260,A third reason for opposing the proposed new office relates to 
6261,problems with which WSPF constantly wrestled. Should our inter- 
6262,"pretation of the campaign laws, the coverage of statutes of limitation, "
6263,"and the perjury, false statement, and obstruction statutes coincide "
6264,with those of the Justice Department? Should our policies regarding 
6265,the use of various intrusive investigative techniques coincide with 
6266,"the Attorney General's? One is moved to answer in the affirmative, "
6267,since those policies are promulgated under normal democratic condi- 
6268,tions of accountability and since different policies easily lead to 
6269,unequal justice. These policy determinations provide great potential 
6270,for a special prosecutor's abuse of power. He can easily stretch from 
6271,proper investigative techniques or attempt unfairly to widen the 
6272,"conduct or the persons included within a criminal sanction. Thus, that "
6273,relatively small group of persons falling within a permanent special 
6274,prosecutor's jurisdiction could be subject to a much heavier hammer of 
6275,Federal criminal law than the rest of the Nation which is subject to 
6276,Department of Justice standards. 
6277,"In looking for alternatives to a permanent, independent prose- "
6278,"cutor, one must first turn to the problem of resource allocation. When "
6279,"the Department of Justice commenced a specialized, intensive effort "
6280,against organized crime in 1958 — with a dramatic expansion in 
6281,1961 — prosecutors found a nationwide string of racketeering enter- 
6282,prises that only a few enforcement personnel had thought existed. 
6283,"So too, in recent years, with adequate resources and personnel the "
6284,"United States Attorneys for the Southern District of New York, the "
6285,"’Northern District of Illinois, Maryland, Florida, New Jersey and "
6286,"elsewhere were able to uncover extensive Federal corruption. Thus, "
6287,these Justice Department representatives have prosecuted Federal 
6288,"executives, members of Congress and a Vice President. "
6289,"This visible, concentrated effort should be institutionalized within "
6290,the Department of Justice. An effort similar to that devoted to 
6291,organized crime should be placed in an expanded section within the 
6292,"Criminal Division or, similar to the proposal of Senators Baker and "
6293,"Percy, in. a new Division of Government Crimes with an Assistant "
6294,Attorney General appointed by the President. This new office should 
6295,also have constant coordination and monitoring responsibilities with 
6296,the various Inspectors General who now inquire into possible corrup- 
6297,tion in the Federal executive departments. 
6298,"In addition, the Attorney General should freely exercise his "
6299,"existing power to appoint special assistants as prosecutors, with "
6300,"independence for particular investigations and cases, whenever a "
6301,real or apparent conflict of interest threatens public confidence in 
6302,139
6303,"the enforcement system. On several occasions, WSPF borrowed "
6304,lawyers from the Department and special assistants can be afforded 
6305,the same advantage for their staffs. 
6306,"Finally, the absence of a permanent, independent prosecutor "
6307,need not dispel the idea that an independent prosecution office can 
6308,"be appointed in the future when activities by the executive, legislative "
6309,or judicial branches of Government show the necessity of a temporary 
6310,office similar to WSPF. 
6311,Congress has the power to enact a statute requiring the President 
6312,"or Attorney General to appoint such a prosecutor, with appropriate "
6313,"safeguards of his jurisdiction and independence, and two-thirds "
6314,majorities of both Houses have the power to override a Presidential 
6315,"veto of such legislation if necessary. In addition, the nature of the "
6316,relationship between Congress and the executive branch provides 
6317,other means of compelling such an appointment. WSPF was created 
6318,because the Senate insisted on such action as a condition of confirming 
6319,the nomination of an Attorney General. Congress can similarly use 
6320,its power to appropriate funds and the Senate can use its confirmation 
6321,power to force such action if necessary. The remedy of impeachment 
6322,remains available as a last resort. 
6323,Attorney Representation of Multiple Interests in Grand Jury Pro- 
6324,ceedings . In almost every investigation which centers on the criminal 
6325,activity of one or more members of a hierarchical structure — whether 
6326,"a corporation, labor union, a Government agency, or a less formally "
6327,organized group — the prosecutor is confronted with a witness who 
6328,"has been called to testify about his employers. Many times, the wit- "
6329,ness is represented by an attorney who also represents the employer 
6330,and perhaps is compensated by him. Although the legal profession’s 
6331,Code of Professional Responsibility forbids a lawyer from representing 
6332,"conflicting or even potentially conflicting interests, lawyers and "
6333,judges historically have been reluctant to enforce the Code’s mandate 
6334,"strictly. They have taken the position that, so long as the witness "
6335,understands that his attorney also represents the person or entity 
6336,about which he will be asked to testify and that he has the right to a 
6337,"lawyer of his own choosing, he cannot be forced to retain new counsel. "
6338,"No lay witness, however, can realistically be expected to appreciate "
6339,"all the legal and practical ramifications of his attorney’s dual loyalties, "
6340,and in many cases he will be precluded from giving adequate consid- 
6341,eration to the possibility of cooperating with the Government by the 
6342,fear that the fact of his cooperation will be revealed to his employer. 
